{
  "manifest_id": "kolosseum_final_registry_schema_authority",
  "manifest_version": "1.0.0",
  "slice_id": "REG-FULL-01",
  "status": "authoritative",
  "schema_scope": "required_active_registries",
  "parent_surface_manifest_id": "kolosseum_final_registry_surface_authority",
  "parent_surface_manifest_version": "1.0.0",
  "parent_surface_manifest_sha256": "e236341a4b5ecb7ad4ca36088b6433bffad51cc0e1da9a9b3f0e22cb88d26489",
  "canonical_id_law": {
    "one_registry_id_per_authority": true,
    "one_primary_key_per_row": true,
    "generic_id_aliases_forbidden": true,
    "foreign_keys_use_target_primary_key_vocabulary": true,
    "display_labels_are_not_ids": true,
    "permanent_dual_read_forbidden": true,
    "forbidden_legacy_field_names": [
      "pattern",
      "movement_id",
      "program_id",
      "id"
    ]
  },
  "registries": [
    {
      "canonical_registry_id": "activity_registry_1",
      "load_position": 1,
      "schema_path": "ci/schemas/activity_registry_1.registry.schema.json",
      "primary_key_field": "activity_id",
      "row_contract_status": "closed",
      "legacy_runtime_projection": {
        "registry_id": "activity",
        "schema_path": "ci/schemas/activity.registry.schema.json",
        "data_path": "registries/activity/activity.registry.json",
        "authority": "compatibility_only"
      },
      "fk_fields": [],
      "optional_fields": []
    },
    {
      "canonical_registry_id": "sport_subdivision_registry_1a",
      "load_position": 2,
      "schema_path": "ci/schemas/sport_subdivision_registry_1a.registry.schema.json",
      "primary_key_field": "sport_subdivision_id",
      "row_contract_status": "closed",
      "legacy_runtime_projection": {
        "registry_id": "sport_subdivision",
        "schema_path": "ci/schemas/sport_subdivision.registry.schema.json",
        "data_path": "registries/sport_subdivision/sport_subdivision.registry.json",
        "authority": "compatibility_only"
      },
      "fk_fields": [
        {
          "field": "activity_id",
          "target_registry_id": "activity_registry_1",
          "target_primary_key_field": "activity_id",
          "cardinality": "one",
          "nullable": false,
          "required": true
        }
      ],
      "optional_fields": []
    },
    {
      "canonical_registry_id": "physical_requirements_registry_1b",
      "load_position": 3,
      "schema_path": "ci/schemas/physical_requirements_registry_1b.registry.schema.json",
      "primary_key_field": null,
      "row_contract_status": "deferred_no_rows",
      "legacy_runtime_projection": null,
      "fk_fields": [],
      "optional_fields": []
    },
    {
      "canonical_registry_id": "sport_metric_registry_1c",
      "load_position": 4,
      "schema_path": "ci/schemas/sport_metric_registry_1c.registry.schema.json",
      "primary_key_field": "sport_metric_id",
      "row_contract_status": "closed",
      "legacy_runtime_projection": {
        "registry_id": "sport_metric",
        "schema_path": "ci/schemas/sport_metric.registry.schema.json",
        "data_path": "registries/sport_metric/sport_metric.registry.json",
        "authority": "compatibility_only"
      },
      "fk_fields": [
        {
          "field": "activity_id",
          "target_registry_id": "activity_registry_1",
          "target_primary_key_field": "activity_id",
          "cardinality": "one",
          "nullable": false,
          "required": true
        },
        {
          "field": "sport_subdivision_id",
          "target_registry_id": "sport_subdivision_registry_1a",
          "target_primary_key_field": "sport_subdivision_id",
          "cardinality": "one",
          "nullable": false,
          "required": true
        }
      ],
      "optional_fields": []
    },
    {
      "canonical_registry_id": "event_metric_registry_1d",
      "load_position": 5,
      "schema_path": "ci/schemas/event_metric_registry_1d.registry.schema.json",
      "primary_key_field": "event_metric_id",
      "row_contract_status": "closed",
      "legacy_runtime_projection": null,
      "fk_fields": [
        {
          "field": "activity_id",
          "target_registry_id": "activity_registry_1",
          "target_primary_key_field": "activity_id",
          "cardinality": "one",
          "nullable": false,
          "required": true
        },
        {
          "field": "sport_subdivision_id",
          "target_registry_id": "sport_subdivision_registry_1a",
          "target_primary_key_field": "sport_subdivision_id",
          "cardinality": "one",
          "nullable": false,
          "required": true
        }
      ],
      "optional_fields": []
    },
    {
      "canonical_registry_id": "sport_role_registry_2",
      "load_position": 6,
      "schema_path": "ci/schemas/sport_role_registry_2.registry.schema.json",
      "primary_key_field": "sport_role_id",
      "row_contract_status": "closed",
      "legacy_runtime_projection": {
        "registry_id": "sport_role",
        "schema_path": "ci/schemas/sport_role.registry.schema.json",
        "data_path": "registries/sport_role/sport_role.registry.json",
        "authority": "compatibility_only"
      },
      "fk_fields": [
        {
          "field": "activity_id",
          "target_registry_id": "activity_registry_1",
          "target_primary_key_field": "activity_id",
          "cardinality": "one",
          "nullable": false,
          "required": true
        },
        {
          "field": "sport_subdivision_id",
          "target_registry_id": "sport_subdivision_registry_1a",
          "target_primary_key_field": "sport_subdivision_id",
          "cardinality": "one",
          "nullable": false,
          "required": true
        }
      ],
      "optional_fields": []
    },
    {
      "canonical_registry_id": "movement_registry_3",
      "load_position": 7,
      "schema_path": "ci/schemas/movement_registry_3.registry.schema.json",
      "primary_key_field": "movement_pattern_id",
      "row_contract_status": "closed",
      "legacy_runtime_projection": {
        "registry_id": "movement",
        "schema_path": "ci/schemas/movement.registry.schema.json",
        "data_path": "registries/movement/movement.registry.json",
        "authority": "compatibility_only"
      },
      "fk_fields": [],
      "optional_fields": []
    },
    {
      "canonical_registry_id": "exercise_registry_3a",
      "load_position": 8,
      "schema_path": "ci/schemas/exercise_registry_3a.registry.schema.json",
      "primary_key_field": "exercise_id",
      "row_contract_status": "closed",
      "legacy_runtime_projection": {
        "registry_id": "exercise",
        "schema_path": "ci/schemas/exercise.registry.schema.json",
        "data_path": "registries/exercise/exercise.registry.json",
        "authority": "compatibility_only"
      },
      "fk_fields": [
        {
          "field": "movement_pattern_id",
          "target_registry_id": "movement_registry_3",
          "target_primary_key_field": "movement_pattern_id",
          "cardinality": "one",
          "nullable": false,
          "required": true
        }
      ],
      "optional_fields": []
    },
    {
      "canonical_registry_id": "exercise_token_registry_3b",
      "load_position": 9,
      "schema_path": "ci/schemas/exercise_token_registry_3b.registry.schema.json",
      "primary_key_field": "exercise_token_id",
      "row_contract_status": "closed",
      "legacy_runtime_projection": {
        "registry_id": "exercise_token",
        "schema_path": "ci/schemas/exercise_token.registry.schema.json",
        "data_path": "registries/exercise_token/exercise_token.registry.json",
        "authority": "compatibility_only"
      },
      "fk_fields": [
        {
          "field": "activity_id",
          "target_registry_id": "activity_registry_1",
          "target_primary_key_field": "activity_id",
          "cardinality": "one",
          "nullable": false,
          "required": true
        },
        {
          "field": "movement_pattern_id",
          "target_registry_id": "movement_registry_3",
          "target_primary_key_field": "movement_pattern_id",
          "cardinality": "one",
          "nullable": false,
          "required": true
        }
      ],
      "optional_fields": []
    },
    {
      "canonical_registry_id": "exercise_alias_registry_3c",
      "load_position": 10,
      "schema_path": "ci/schemas/exercise_alias_registry_3c.registry.schema.json",
      "primary_key_field": "alias_id",
      "row_contract_status": "closed",
      "legacy_runtime_projection": null,
      "fk_fields": [
        {
          "field": "canonical_exercise_token_id",
          "target_registry_id": "exercise_token_registry_3b",
          "target_primary_key_field": "exercise_token_id",
          "cardinality": "one",
          "nullable": false,
          "required": true
        }
      ],
      "optional_fields": []
    },
    {
      "canonical_registry_id": "exercise_variant_applicability_registry_3d",
      "load_position": 11,
      "schema_path": "ci/schemas/exercise_variant_applicability_registry_3d.registry.schema.json",
      "primary_key_field": "variant_id",
      "row_contract_status": "closed",
      "legacy_runtime_projection": null,
      "fk_fields": [
        {
          "field": "base_exercise_token_id",
          "target_registry_id": "exercise_token_registry_3b",
          "target_primary_key_field": "exercise_token_id",
          "cardinality": "one",
          "nullable": false,
          "required": true
        },
        {
          "field": "variant_exercise_token_id",
          "target_registry_id": "exercise_token_registry_3b",
          "target_primary_key_field": "exercise_token_id",
          "cardinality": "one",
          "nullable": false,
          "required": true
        }
      ],
      "optional_fields": []
    },
    {
      "canonical_registry_id": "equipment_environment_registry_3e",
      "load_position": 12,